{
  "scc_id": "SCC-2026-04-003",
  "rule_bundle_required": "sdaia-scc-v0.1-2024-09-02",
  "scc_template": {
    "template_id": "controller_to_processor",
    "exporter_role": "CONTROLLER",
    "importer_role": "PROCESSOR",
    "official_template_ref": "SDAIA SCC Second Template (Controller to Processor)"
  },
  "parties": {
    "exporter": {
      "legal_name": "Example KSA Hospital",
      "cr_number": "1010000001",
      "registered_address": "Jeddah, Kingdom of Saudi Arabia",
      "country": "SA",
      "role": "CONTROLLER"
    },
    "importer": {
      "legal_name": "Example Foreign Health Processor Ltd.",
      "cr_number": "GB-000000",
      "registered_address": "London, United Kingdom",
      "country": "GB",
      "role": "PROCESSOR"
    }
  },
  "subject_matter": {
    "data_categories": ["name", "national_id", "medical_record"],
    "data_subjects": ["patients"],
    "sensitive_categories_art18": ["health"],
    "purpose": "cross-border clinical triage support",
    "transfer_basis": "standard_contractual_clauses",
    "duration": { "start": "2026-05-01", "end": "2027-04-30" }
  },
  "obligations": {
    "exporter": [ { "id": "EXP-01", "text_ref": "section_3_item_1", "committed": true } ],
    "importer": [ { "id": "IMP-01", "text_ref": "section_4_item_1", "committed": true } ]
  },
  "data_subject_rights": { "response_window_days": 30 },
  "security": {
    "toms_snapshot_ref": "toms-snapshot-2026-04-17T14:00:00Z",
    "toms_snapshot_hash": "sha256:0000000000000000000000000000000000000000000000000000000000000003"
  },
  "breach_notification": {
    "exporter_notification_window_hours": 24,
    "sdaia_notification_window_hours": 72
  },
  "onward_transfers": {
    "permitted": true,
    "sub_processor_list_ref": "subprocessors-2026-04-17"
  },
  "audit_rights": { "notice_period_days": 10, "scope": "compliance-with-these-clauses" },
  "governing_law": {
    "jurisdiction": "Kingdom of Saudi Arabia",
    "dispute_forum": "Saudi courts"
  },
  "term": { "effective_date": "2026-05-01", "termination_notice_days": 30 },
  "liability": { "cap_amount_sar": 1000000, "rationale_ref": "liability-rationale-2026-04-17" },
  "annex_a_tra": {
    "tra_id": "TRA-2026-04-003",
    "risk_level": "high",
    "approved_at": "2026-04-15",
    "expires_at": "2027-04-15"
  },
  "annex_b_toms_ref": "toms-snapshot-2026-04-17T14:00:00Z",
  "annex_c_subprocessors": [],
  "signatures": {
    "exporter": { "name": "Jane Doe", "title": "DPO", "signed_at": "2026-04-30T12:00:00Z", "signature_ref": "sig-exp" },
    "importer": { "name": "John Smith", "title": "Authorized Signatory", "signed_at": "2026-04-30T12:05:00Z", "signature_ref": "sig-imp" }
  }
}
